product_id,product_name,category_id,original_price,stock,brand,slug,vendor_id,ratings,product_description,date_add
5171372,"1 PC Teacher Pattern Shopping Bag, Casual Canvas Portable Shoulder Bag Handbag, Reusable Foldable Storage Tote Bag, Gift",15,16.64,1083,No Brand,1-pc-teacher-pattern-shopping-bag-casual-canvas-portable-shoulder-bag-handbag-reusable-foldable-storage-tote-bag-gift,1,3.3,no description,2024-04-10
5181370,2023 New Spring Summer Light Canvas Shoes Men Breathable Men Shoes Loafers Soft Comfortable Outdoor Flat Lazy Shoes for Male,134473,69.2,499,No Brand,2023-new-spring-summer-light-canvas-shoes-men-breathable-men-shoes-loafers-soft-comfortable-outdoor-flat-lazy-shoes-for-male,2,3.3,no description,2024-03-07
159278,Electric Head Massager Scalp Massage Claw Physiotherapy Decompression Head Scratcher Stress Relief Improve Sleep,128915,42.71,94,No Brand,electric-head-massager-scalp-massage-claw-physiotherapy-decompression-head-scratcher-stress-relief-improve-sleep,2,4.7,no description,2024-05-20
5173243,I'm A Teacher What's Your Superpower Teacher Life Canvas Black Shopping Tote Bag Reusable Shoulder Cloth Book Bag Gift Handbag,15,13.5,768,No Brand,im-a-teacher-whats-your-superpower-teacher-life-canvas-black-shopping-tote-bag-reusable-shoulder-cloth-book-bag-gift-handbag,2,2.6,no description,2024-05-20
283871,10Pcs Big Gradient Glitter Resin Bear Charms for Earrings Bracelet Necklace Pendant Jewelry Making Accessories Diy Findings,120662,12.0,9985,No Brand,10pcs-big-gradient-glitter-resin-bear-charms-for-earrings-bracelet-necklace-pendant-jewelry-making-accessories-diy-findings,2,2.6,no description,2024-04-27
299674,Wood Therapy Massage Comb Head Face Scalp Gua Sha Massager Natural Facial Sandalwood Wide Tooth Guasha Scraping Body Massage,128915,10.45,391,No Brand,wood-therapy-massage-comb-head-face-scalp-gua-sha-massager-natural-facial-sandalwood-wide-tooth-guasha-scraping-body-massage,1,3.1,no description,2024-04-18
306523,Diamond Women Clutch Evening Bags Bridal Crystal Flower Handbags Purses Luxurious Wedding Party Dinner Bag 2023 New,15,60.76,277,No Brand,diamond-women-clutch-evening-bags-bridal-crystal-flower-handbags-purses-luxurious-wedding-party-dinner-bag-2023-new,1,3.5,no description,2024-03-07
304530,Fascia Massager Gun Head Silicone Deep Tissue Massage Head Waterproof Muscle Massager Heads Fascia Massager Guns Acessory Relax,128915,51.79,487,No Brand,fascia-massager-gun-head-silicone-deep-tissue-massage-head-waterproof-muscle-massager-heads-fascia-massager-guns-acessory-relax,1,3.8,no description,2024-05-25
286932,51pcs/Set Zinc Alloy Antique Silvery Instrument Notes Shaped Pendants for DIY Necklace Bracelet Earrings Jewelry Making Handmade,120662,17.66,382,No Brand,51pcsset-zinc-alloy-antique-silvery-instrument-notes-shaped-pendants-for-diy-necklace-bracelet-earrings-jewelry-making-handmade,2,2.7,no description,2024-04-18
309460,Mijia Massage Gun Electric Neck Massager Smart Hit Fascia Gun for Body Massage Relaxation Fitness Muscle Pain Relief,128915,209.95,50,No Brand,mijia-massage-gun-electric-neck-massager-smart-hit-fascia-gun-for-body-massage-relaxation-fitness-muscle-pain-relief,2,1.6,no description,2024-05-09
290570,925 Sterling Silver Little Mermaid Ariel Sebastian Dangle Charm Fit Original PAND0RA Bracelet for women fashion jewelry gift,120662,12.66,691,No Brand,925-sterling-silver-little-mermaid-ariel-sebastian-dangle-charm-fit-original-pand0ra-bracelet-for-women-fashion-jewelry-gift,1,2.8,no description,2024-04-17
686242,Electric Hip Waist Support Massage Cushion Waist And Hip Integrated Massage Pad Multi-function Timing Correction Massager,128915,251.08,99,No Brand,electric-hip-waist-support-massage-cushion-waist-and-hip-integrated-massage-pad-multi-function-timing-correction-massager,2,4.1,no description,2024-03-02
366351,Cardboard Jewelry Boxes Set Black Necklace Gifts Present For Necklaces Bracelets Earrings Rings Storage Display Boxes,120662,2.98,5997,No Brand,cardboard-jewelry-boxes-set-black-necklace-gifts-present-for-necklaces-bracelets-earrings-rings-storage-display-boxes,1,1.7,no description,2024-05-10
316067,Mini Muscle Deep Tissue Percussion Massage Touch Screen Fascia Gun With Ems Lcd Display Low Noise Massagegun 6Speed Adjustment,128915,131.5,999,No Brand,mini-muscle-deep-tissue-percussion-massage-touch-screen-fascia-gun-with-ems-lcd-display-low-noise-massagegun-6speed-adjustment,2,2.2,no description,2024-03-17
5181911,Amy and Michael 2022 Spring Cute Girls Students High Top Canvas Shoes Lovely Anime Hand Painted Plimsolls Woman Vulcanize Shoes,134473,112.1,74,No Brand,amy-and-michael-2022-spring-cute-girls-students-high-top-canvas-shoes-lovely-anime-hand-painted-plimsolls-woman-vulcanize-shoes,1,2.0,no description,2024-05-09
316138,Opove M3 Fascial Massage Professional Fitness Massage Gun Percussion Deep Muscle Massager Newest Super Quiet Massage Machine,128915,221.0,1000,No Brand,opove-m3-fascial-massage-professional-fitness-massage-gun-percussion-deep-muscle-massager-newest-super-quiet-massage-machine,1,1.7,no description,2024-05-23
295897,10pcs/lot diy dachshund dog cat paw stainless steel charm pendant wholesale elephant bone jewelry bracelet connector charms,120662,11.55,993,No Brand,10pcslot-diy-dachshund-dog-cat-paw-stainless-steel-charm-pendant-wholesale-elephant-bone-jewelry-bracelet-connector-charms,1,3.7,no description,2024-05-18
317726,Women's Crossbody Bag Waterproof Nylon Oxford Shoulder Messenger Bags Casual Large Capacity Handbag Ladies Travel Shopping Tote,15,19.14,18,No Brand,womens-crossbody-bag-waterproof-nylon-oxford-shoulder-messenger-bags-casual-large-capacity-handbag-ladies-travel-shopping-tote,1,1.1,no description,2024-05-06
320200,European and American Fashion New Women's Bag Cross Pattern PU Leather Women's One Shoulder Crossbody Bag Chain Shell Bag,15,61.66,96,No Brand,european-and-american-fashion-new-womens-bag-cross-pattern-pu-leather-womens-one-shoulder-crossbody-bag-chain-shell-bag,1,2.8,no description,2024-04-16
305802,Women Jewelry Holder Organizer Multifunction Necklace Earring Ring Storage Box for Travel,120662,38.53,996,No Brand,women-jewelry-holder-organizer-multifunction-necklace-earring-ring-storage-box-for-travel,2,1.7,no description,2024-04-08
327643,Cool Soccerly Footbally Print Wallet Basketball Coin Money Bags ID Credit Card Phone Holder Women Casual Long Purse Gift,15,16.6,998,No Brand,cool-soccerly-footbally-print-wallet-basketball-coin-money-bags-id-credit-card-phone-holder-women-casual-long-purse-gift,1,2.9,no description,2024-03-28
328359,Mini High Quality Portable massage gun Electric Fascia Gun Massager For Body Neck Back Deep Tissue Muscle Relaxation Non-noise,128915,88.35,20,No Brand,mini-high-quality-portable-massage-gun-electric-fascia-gun-massager-for-body-neck-back-deep-tissue-muscle-relaxation-non-noise,2,2.2,no description,2024-03-17
661401,Trendy Fine 14K Real Gold Noble Crown Chain Pendant Necklace for Women Accessories Original Design Fashion Jewelry Zircon Party,120662,12.84,88517,No Brand,trendy-fine-14k-real-gold-noble-crown-chain-pendant-necklace-for-women-accessories-original-design-fashion-jewelry-zircon-party,1,3.2,no description,2024-03-06
661085,New Fashion Lovely Balloon Dog Pendant Necklace for Women Simple Stereo Geometry Metal Clavicle Chain Girl Couple Jewelry Gift,120662,11.15,43,No Brand,new-fashion-lovely-balloon-dog-pendant-necklace-for-women-simple-stereo-geometry-metal-clavicle-chain-girl-couple-jewelry-gift,2,2.3,no description,2024-04-12
661260,777 Angel Number Neckalces For Women Stainless Steel 111 222 333 444 555 Pendant Necklace Goth Chain Collar Choker Jewelry Gift,120662,12.72,19,No Brand,777-angel-number-neckalces-for-women-stainless-steel-111-222-333-444-555-pendant-necklace-goth-chain-collar-choker-jewelry-gift,1,3.9,no description,2024-05-02
662953,Flashbuy Trendy Black White Round Pendant Necklace for Women Girls Statement Gold Silver Color Chain Necklace Fashion Jewelry,120662,11.62,18,No Brand,flashbuy-trendy-black-white-round-pendant-necklace-for-women-girls-statement-gold-silver-color-chain-necklace-fashion-jewelry,2,2.4,no description,2024-04-04
663060,Anime Death Note L Lawliet Necklace Stainless Steel Old English Letter Pendant Beads Chain Necklaces Cosplay Jewelry Gift,120662,2.12,5858,No Brand,anime-death-note-l-lawliet-necklace-stainless-steel-old-english-letter-pendant-beads-chain-necklaces-cosplay-jewelry-gift,2,2.9,no description,2024-03-24
662590,Punk Snake Chain Bracelet Bangles Goth Snake Necklace for Women Jewelry Hip Hop Men's Choker Adjustable Metal Jewelry Party Gift,120662,11.7,6222,No Brand,punk-snake-chain-bracelet-bangles-goth-snake-necklace-for-women-jewelry-hip-hop-mens-choker-adjustable-metal-jewelry-party-gift,1,2.2,no description,2024-04-06
314906,5pcs Light Green Jewelry Gold Snap Button Bags Chic Small Wedding Favor Bag Microfiber Pouch for Jewelry Ring Necklace Earring,120662,12.66,5748,No Brand,5pcs-light-green-jewelry-gold-snap-button-bags-chic-small-wedding-favor-bag-microfiber-pouch-for-jewelry-ring-necklace-earring,2,4.0,no description,2024-05-17
337428,FOXER Women Split Leather Crossbody Bag Fashion Lady High Capacity Messenger Bag For Female Zipper Soft Small Flap Shoulder Bags,15,148.79,20,FOXER,foxer-women-split-leather-crossbody-bag-fashion-lady-high-capacity-messenger-bag-for-female-zipper-soft-small-flap-shoulder-bags,2,1.3,no description,2024-03-09
336566,PU Square Messenger Bags Casual Clear Heart Shaped Shoulder Bag Women School Bags PU Leather Purse Ita Bag,15,22.06,9988,No Brand,pu-square-messenger-bags-casual-clear-heart-shaped-shoulder-bag-women-school-bags-pu-leather-purse-ita-bag,1,3.3,no description,2024-05-23
664303,One Pieces Mother's Day Gift Steel Chain Heart Necklaces for Women Girls Minimalist Bijoux Cheap Items with Free Shipping,120662,2.68,869,No Brand,one-pieces-mothers-day-gift-steel-chain-heart-necklaces-for-women-girls-minimalist-bijoux-cheap-items-with-free-shipping,2,2.8,no description,2024-05-03
244959,Large size available Multi-purpose Stylish Shoulder Bag for Woman Casual Crossbody Bag Oxford Canvas Shell Bag Small Shoulder Ba,15,39.69,5555,No Brand,large-size-available-multi-purpose-stylish-shoulder-bag-for-woman-casual-crossbody-bag-oxford-canvas-shell-bag-small-shoulder-ba,2,3.9,no description,2024-04-17
324282,Floating Packaging box Jewelry Display Box Bracelet Badge Dust Jewelry Storage Box,120662,8.1,100,No Brand,floating-packaging-box-jewelry-display-box-bracelet-badge-dust-jewelry-storage-box,2,1.7,no description,2024-03-19
324368,5pcs Beige Jewelry Organizer Packaging Pouch Microfiber Small Gift Bags for Necklace Earring Wedding Favor Candy Storage Bag,120662,15.82,27,No Brand,5pcs-beige-jewelry-organizer-packaging-pouch-microfiber-small-gift-bags-for-necklace-earring-wedding-favor-candy-storage-bag,1,2.9,no description,2024-03-16
349056,KUROYABU Rectangle Shell Bag Temperament Women Bag Business Small Women's Handbag Classical Printing Leather Bag Bolsas Mujer,15,100.83,9993,KUROYABU,kuroyabu-rectangle-shell-bag-temperament-women-bag-business-small-womens-handbag-classical-printing-leather-bag-bolsas-mujer,2,1.8,no description,2024-04-16
665505,Hollow Korean Sweet Cute Love Statement Heart Chain Collar Jewelry Choker Necklace for Girlfriend Women Gift Cosplay,120662,7.52,9920,No Brand,hollow-korean-sweet-cute-love-statement-heart-chain-collar-jewelry-choker-necklace-for-girlfriend-women-gift-cosplay,2,4.5,no description,2024-03-04
7024694,Pablo Picasso Don Quixote Luggage Tags Custom Spanish Artist Baggage Tags Privacy Cover Name ID Card,15,2.55,999,No Brand,pablo-picasso-don-quixote-luggage-tags-custom-spanish-artist-baggage-tags-privacy-cover-name-id-card,2,1.3,no description,2024-05-27
332278,New3x5cm Christmas paper Tag 50pcs+50 hemp rope Christmas and New Year gift packaging label Tags,120662,9.18,27,No Brand,new3x5cm-christmas-paper-tag-50pcs50-hemp-rope-christmas-and-new-year-gift-packaging-label-tags,1,4.1,no description,2024-04-11
682978,Mindesa High Quality Portable Nylon Best Fashion Leisure Shoulder Bag Crossbody Bag Ladies Bag And Men Bag Waterproof 8620,15,75.62,200,No Brand,mindesa-high-quality-portable-nylon-best-fashion-leisure-shoulder-bag-crossbody-bag-ladies-bag-and-men-bag-waterproof-8620,1,4.1,no description,2024-03-09
357092,"OPOVE M3 mini Massage Gun, 265g, Ultra Lightweight, Equipped with Face Mode, 7mm Amplitude, 5 Types of interchangeable heads",128915,147.93,808,OPOVE,opove-m3-mini-massage-gun-265g-ultra-lightweight-equipped-with-face-mode-7mm-amplitude-5-types-of-interchangeable-heads,2,2.0,no description,2024-04-01
332626,Natural Cotton Envelope Gift Bags 10x8cm 10x10cm 20x15cm Custom Logo Canvas Sack Jewelry Flap Pouches,120662,144.4,125,No Brand,natural-cotton-envelope-gift-bags-10x8cm-10x10cm-20x15cm-custom-logo-canvas-sack-jewelry-flap-pouches,1,4.4,no description,2024-05-24
341790,Square Paper Drawer Jewelry Box Greeting Card Necklace Ring Earing Bracelet Storage Organizer Display Jewelry Packaging Box 2023,120662,6.27,9844,No Brand,square-paper-drawer-jewelry-box-greeting-card-necklace-ring-earing-bracelet-storage-organizer-display-jewelry-packaging-box-2023,1,3.0,no description,2024-03-08
365891,Electric Handheld Shoulder Percussion Massage Stick Cervical Spine Back Waist Fascia Gun Whole Body Meridians Muscle Relaxer,128915,182.54,99,No Brand,electric-handheld-shoulder-percussion-massage-stick-cervical-spine-back-waist-fascia-gun-whole-body-meridians-muscle-relaxer,1,1.0,no description,2024-05-12
342333,Hanging Storage Bag Jewelry Holder Necklace Bracelet Earring Ring Jewelry Organizers and Storage Jewelry Box ( No Hanger）,120662,14.62,10469,No Brand,hanging-storage-bag-jewelry-holder-necklace-bracelet-earring-ring-jewelry-organizers-and-storage-jewelry-box-no-hanger,1,1.4,no description,2024-04-14
342228,Jewelry Box Double Layer Solid Wood Antique Earrings Bracelet Jewelry Storage Box Ins Style Luxurious Exquisite Dropshipping New,120662,116.83,19220,No Brand,jewelry-box-double-layer-solid-wood-antique-earrings-bracelet-jewelry-storage-box-ins-style-luxurious-exquisite-dropshipping-new,1,3.1,no description,2024-03-19
378595,Deep Tissue Muscle Massage Gun Neck Body Pain Relief Mini Massager High Frequency Relax Fascial Gun,128915,83.79,5000,No Brand,deep-tissue-muscle-massage-gun-neck-body-pain-relief-mini-massager-high-frequency-relax-fascial-gun,1,3.0,no description,2024-05-21
356804,Resin Side Face Portrait Model Necklace Jewelry Stand Storage Earrings Hanging Bracelet Ring Jewelry Display Props OK Hand Model,120662,75.45,8,No Brand,resin-side-face-portrait-model-necklace-jewelry-stand-storage-earrings-hanging-bracelet-ring-jewelry-display-props-ok-hand-model,1,1.3,no description,2024-05-29
377288,2023 Luxury Ruched Evening Clutch Bag Designer Diamonds Women Handbags Crystal Mesh Shoulder Bags Shinny Rhinestone Party Purses,15,133.0,997,No Brand,2023-luxury-ruched-evening-clutch-bag-designer-diamonds-women-handbags-crystal-mesh-shoulder-bags-shinny-rhinestone-party-purses,1,3.1,no description,2024-03-26
5222732,2024 Europa e America Viaggio di Grande Capacità Borsa delle Donne Nuovo Handmade Tassel Handbag Fashion Stampato Borsa di Tela,15,80.69,162,No Brand,2024-europa-e-america-viaggio-di-grande-capacita-borsa-delle-donne-nuovo-handmade-tassel-handbag-fashion-stampato-borsa-di-tela,1,4.4,no description,2024-03-15
370366,Jewelry Box Women Jewelry Organizer Display Travel Jewelry Case Classification Boxes Storage Jewelers Joyero Rose Gold Initials,120662,18.64,521,No Brand,jewelry-box-women-jewelry-organizer-display-travel-jewelry-case-classification-boxes-storage-jewelers-joyero-rose-gold-initials,2,2.5,no description,2024-04-05
370545,Transparent Film Box Ear Jewelry Packaking Storage Box Portable Anti Oxidation PE Film Ear Clip Necklace Gift Box,120662,2.88,38,No Brand,transparent-film-box-ear-jewelry-packaking-storage-box-portable-anti-oxidation-pe-film-ear-clip-necklace-gift-box,1,2.5,no description,2024-03-30
380673,10Pcs Hot Sale Jewelry Packaging Box Ring Earring Cases Acrylic Transparent Wedding Packaging Woman Jewelry Box Cheap Wholesale,120662,15.38,99961,No Brand,10pcs-hot-sale-jewelry-packaging-box-ring-earring-cases-acrylic-transparent-wedding-packaging-woman-jewelry-box-cheap-wholesale,1,5.0,no description,2024-05-25
687212,Fashion Embroidery Women Envelope Clutch Bag Ladies Evening Party Large Capacity Clutches Handbag PU Leather Phone Purses Bolsas,15,13.0,1013,No Brand,fashion-embroidery-women-envelope-clutch-bag-ladies-evening-party-large-capacity-clutches-handbag-pu-leather-phone-purses-bolsas,1,3.7,no description,2024-05-20
413761,Automatically Heated Insert Doll Vaginette Silicone Ass Chocho Real Uterus Artificial Sex For Man Women Vibrator Back,128915,53.05,1000,No Brand,automatically-heated-insert-doll-vaginette-silicone-ass-chocho-real-uterus-artificial-sex-for-man-women-vibrator-back,2,3.4,no description,2024-03-18
389137,Free shipping 1PC Black Velvet Gift Bag Jewelry Pouches Drawstring Bag 7x9cm,120662,2.07,26,No Brand,free-shipping-1pc-black-velvet-gift-bag-jewelry-pouches-drawstring-bag-7x9cm,2,4.2,no description,2024-05-16
7033014,Hot Sale 1pcs PVC Shoe Charms English Coconut Tree Kangaroo USA Accessorie DIY Shoe Decorations For Croc Jibz Kids X-mas Gift,134473,3.96,2000,No Brand,hot-sale-1pcs-pvc-shoe-charms-english-coconut-tree-kangaroo-usa-accessorie-diy-shoe-decorations-for-croc-jibz-kids-x-mas-gift,2,4.0,no description,2024-03-14
673474,Vintage Fashion Leather rope Star Pendant Necklace For Women Men Antique Silver Color Jewelry Accessories Y2k Aesthetic,120662,7.14,49938,No Brand,vintage-fashion-leather-rope-star-pendant-necklace-for-women-men-antique-silver-color-jewelry-accessories-y2k-aesthetic,1,4.2,no description,2024-04-11
673581,Arabic Imam Ali Zulfiqar Sword Necklace Chain for Men Stainless Steel Muslim Islam Knife Islamic Accessories Jewelry N558S01,120662,11.07,177,No Brand,arabic-imam-ali-zulfiqar-sword-necklace-chain-for-men-stainless-steel-muslim-islam-knife-islamic-accessories-jewelry-n558s01,1,3.5,no description,2024-04-13
424469,Mini LCD Massage Gun 32 Speed Touch Screen Deep Tissue Percussion Muscle Mini Massager Fascial Gun For Pain Relief Body Massage,128915,91.2,50000,No Brand,mini-lcd-massage-gun-32-speed-touch-screen-deep-tissue-percussion-muscle-mini-massager-fascial-gun-for-pain-relief-body-massage,2,1.1,no description,2024-04-29
424688,Gua Sha Face Massage Beauty Tool Mushroom Shape Terahertz Energy Stone Guasha Scraping Facial Massager for Spa Body Relaxing,128915,19.55,92,No Brand,gua-sha-face-massage-beauty-tool-mushroom-shape-terahertz-energy-stone-guasha-scraping-facial-massager-for-spa-body-relaxing,2,3.3,no description,2024-05-18
398017,1pcs Double Layer Storage Box Ladies Light Luxury Style Clever Compartment Design Leather Jewelry Box,120662,28.54,164,No Brand,1pcs-double-layer-storage-box-ladies-light-luxury-style-clever-compartment-design-leather-jewelry-box,1,5.0,no description,2024-04-19
5242257,1:12 Doll House Mini Simulation Wooden Furniture Miniature Three-tier Storage Rack Flower Stand European Furniture Model,125610,15.3,5,No Brand,112-doll-house-mini-simulation-wooden-furniture-miniature-three-tier-storage-rack-flower-stand-european-furniture-model,1,1.5,no description,2024-04-18
428463,Deep Tissue Therapy Muscle Massage Gun Electric Fascia Body Massager Exercising Fitness Relaxation Slimming Shaping Pain Relief,128915,213.84,1021,No Brand,deep-tissue-therapy-muscle-massage-gun-electric-fascia-body-massager-exercising-fitness-relaxation-slimming-shaping-pain-relief,2,2.7,no description,2024-03-15
