product_id,product_name,category_id,original_price,stock,brand,slug,vendor_id,ratings,product_description,date_add
250717,925 Sterling Silver charms Snow White Princess pendant Fit Original Pandora Bracelet Herocross disney apple jewelry women gift,120662,14.1,983,No Brand,925-sterling-silver-charms-snow-white-princess-pendant-fit-original-pandora-bracelet-herocross-disney-apple-jewelry-women-gift,2,5.0,no description,2024-05-28
275245,Luxury Saddle Women's Chest Bag Crossbody Bags Female Fashion Chain Handbag Hobos Bag Banana Belt Purse Banana Bag Fanny Packs,15,12.72,2000,No Brand,luxury-saddle-womens-chest-bag-crossbody-bags-female-fashion-chain-handbag-hobos-bag-banana-belt-purse-banana-bag-fanny-packs,2,3.1,no description,2024-03-15
5158807,Women's Shoulder Canvas Bag Large With Chain Capacity for women on offer 2023 new,15,73.07,30,No Brand,womens-shoulder-canvas-bag-large-with-chain-capacity-for-women-on-offer-2023-new,1,3.5,no description,2024-03-29
654066,Lucky Eye Plastic Round Pendant Necklace Leather Rope Chain Turkish Evil Eye Necklace for Women Men Jewelry collar collier שרשרת,120662,2.91,32,No Brand,lucky-eye-plastic-round-pendant-necklace-leather-rope-chain-turkish-evil-eye-necklace-for-women-men-jewelry-collar-collier,1,1.1,no description,2024-03-15
653813,316L Stainless Steel Necklace For Women Heart Pendant Necklaces Coin Eye Charm Chain Choker Necklace Jewelry Gifts Wholesale,120662,15.2,978,No Brand,316l-stainless-steel-necklace-for-women-heart-pendant-necklaces-coin-eye-charm-chain-choker-necklace-jewelry-gifts-wholesale,1,3.5,no description,2024-05-22
272411,Gua Sha Scraping Massage Toolfor Back Legs Arm Neck Shoulder SPA Massage,128915,2.38,999,No Brand,gua-sha-scraping-massage-toolfor-back-legs-arm-neck-shoulder-spa-massage,1,1.8,no description,2024-05-17
272529,Meridian Point Lymphatic Acid Drainage Magnetotherapy Pen Magnetic Therapy Acid Discharge Fork Massage Shoulder Neck Massager,128915,97.34,999,No Brand,meridian-point-lymphatic-acid-drainage-magnetotherapy-pen-magnetic-therapy-acid-discharge-fork-massage-shoulder-neck-massager,1,1.7,no description,2024-03-27
5085621,Outdoor tactical gloves multifunctional sports gloves half-finger military men's combat gloves shooting hunting gloves women,137646,2.67,699,No Brand,outdoor-tactical-gloves-multifunctional-sports-gloves-half-finger-military-mens-combat-gloves-shooting-hunting-gloves-women,1,2.3,no description,2024-04-28
670409,Women's Leather Senior Sense Fashion Chain Shoulder Sling Crossbody Messenger Bag,15,40.11,6,No Brand,womens-leather-senior-sense-fashion-chain-shoulder-sling-crossbody-messenger-bag,1,4.4,no description,2024-03-26
670357,Designer Bag Fashion Stitching Tote Bags for Women New Shoulder Bag Luxury Purses and Handbag Brand Satchel Cute Messenger Bag,15,79.29,524,No Brand,designer-bag-fashion-stitching-tote-bags-for-women-new-shoulder-bag-luxury-purses-and-handbag-brand-satchel-cute-messenger-bag,1,4.8,no description,2024-04-24
670451,Love Heart Print Bags For Women 2023 Soft Plush Shoulder Bags Female Leopard Pattern Handbag Winter Warm Fluffy Shopping Bags,15,19.33,249939,No Brand,love-heart-print-bags-for-women-2023-soft-plush-shoulder-bags-female-leopard-pattern-handbag-winter-warm-fluffy-shopping-bags,2,2.8,no description,2024-03-23
5157522,"Tactical Glove Clip for Work Glove Holders with 2 Alligator Clips for Tool Belt,Tactical Bag,Outdoor Accessory",137646,52.38,98,No Brand,tactical-glove-clip-for-work-glove-holders-with-2-alligator-clips-for-tool-belttactical-bagoutdoor-accessory,1,3.0,no description,2024-05-08
5025072,Tactical Military Full Finger Gloves Leather Airsoft Army Combat Touch Screen Anti-Skid Hard Knuckle Protective Gear Gloves Men,137646,113.58,8,No Brand,tactical-military-full-finger-gloves-leather-airsoft-army-combat-touch-screen-anti-skid-hard-knuckle-protective-gear-gloves-men,2,2.1,no description,2024-04-02
272577,"Mini Neck Massager Cervical Vertebra Massager, Portable Shoulder Back Massage Mat, Foot Legs Full Body Massage Pain Relief",128915,20.27,19994,No Brand,mini-neck-massager-cervical-vertebra-massager-portable-shoulder-back-massage-mat-foot-legs-full-body-massage-pain-relief,2,1.4,no description,2024-04-28
275076,New EVA Chick Schoolbag Children Backpack Hard Shell Backpack Cartoon Lovely Mini Shoulder Bag Kids Cute Bags,15,39.71,25985,No Brand,new-eva-chick-schoolbag-children-backpack-hard-shell-backpack-cartoon-lovely-mini-shoulder-bag-kids-cute-bags,2,2.7,no description,2024-04-01
5160460,Outdoor Hunting Hiking Military Airsoft Touch Screen Full Finger Gloves Mens Tactical Gloves Army Shooting Fingerless Gloves,137646,19.34,49,No Brand,outdoor-hunting-hiking-military-airsoft-touch-screen-full-finger-gloves-mens-tactical-gloves-army-shooting-fingerless-gloves,2,1.8,no description,2024-04-30
272903,2023 Manual One Head Spine Massage Gun 6 Levels Portable Chiropractic Adjusting Tool Muscle Relaxation Therapy Spinal Massager,128915,181.58,300,No Brand,2023-manual-one-head-spine-massage-gun-6-levels-portable-chiropractic-adjusting-tool-muscle-relaxation-therapy-spinal-massager,2,1.0,no description,2024-05-07
5158766,"Teach Them, Love Them, Watch Them Grow Pattern Tote Bag, Floral Teacher Shoulder Bag Tote Bag, Gifts For Teachers",15,16.76,981,No Brand,teach-them-love-them-watch-them-grow-pattern-tote-bag-floral-teacher-shoulder-bag-tote-bag-gifts-for-teachers,2,3.8,no description,2024-03-06
5158588,2022 Custom White Fashion Travel Canvas Bags Tote Bag Shopping Your Images Here Print Original Design Grocery Bag Pures Shopper,15,15.96,988,No Brand,2022-custom-white-fashion-travel-canvas-bags-tote-bag-shopping-your-images-here-print-original-design-grocery-bag-pures-shopper,2,4.7,no description,2024-03-31
5082817,Touch Screen Tactical Gloves Military Army Paintball Shooting Hunting Airsoft Combat Anti-Skid Work Protection Full Finger Glove,137646,20.24,1999,No Brand,touch-screen-tactical-gloves-military-army-paintball-shooting-hunting-airsoft-combat-anti-skid-work-protection-full-finger-glove,1,3.0,no description,2024-03-27
5159642,Black Tactical Gloves Men Women Climbing Fingerless Army Military Training Gloves For Fishing Motorcycle Biker Gloves Mittens,137646,46.28,998,No Brand,black-tactical-gloves-men-women-climbing-fingerless-army-military-training-gloves-for-fishing-motorcycle-biker-gloves-mittens,1,2.4,no description,2024-04-21
5081799,Touch Screen Tactical Gloves Army Military Gym Men Paintball Airsoft Shooting Combat Sports Cycling Hard Full Finger Gloves,137646,71.17,50,No Brand,touch-screen-tactical-gloves-army-military-gym-men-paintball-airsoft-shooting-combat-sports-cycling-hard-full-finger-gloves,2,3.7,no description,2024-03-16
275612,Yogodlns Vintage Pattern 2pcs Crossbody Bags Women Shoulder Shell Bag Trend Small Purse and Handbag Luxury Designer Female Bag,15,13.1,10,No Brand,yogodlns-vintage-pattern-2pcs-crossbody-bags-women-shoulder-shell-bag-trend-small-purse-and-handbag-luxury-designer-female-bag,1,4.8,no description,2024-03-27
273383,Neck Roller Massager Pressure Trigger Point Shoulder Massager Tool Lightweight & Portable Neck Massager Suitable For Neck Hands,128915,10.7,999,No Brand,neck-roller-massager-pressure-trigger-point-shoulder-massager-tool-lightweight-portable-neck-massager-suitable-for-neck-hands,1,4.2,no description,2024-04-02
252212,Children's Pendant S925 Sterling Silver Baby Pacifier Dangle Charm Fits Pandora Bracelet Children's Cute Jewelry Accessories,120662,14.25,909,No Brand,childrens-pendant-s925-sterling-silver-baby-pacifier-dangle-charm-fits-pandora-bracelet-childrens-cute-jewelry-accessories,1,4.0,no description,2024-05-12
252541,10pcs Alloy Charm Cartoon Anime Character Earrings Pendant DIY Keychain Hanging Chain Jewelry Handmade Accessories Earring Charm,120662,2.92,9987,No Brand,10pcs-alloy-charm-cartoon-anime-character-earrings-pendant-diy-keychain-hanging-chain-jewelry-handmade-accessories-earring-charm,1,2.2,no description,2024-03-19
271686,1PC Claw Massager Body Massager Octopus Head Scalp Neck Equipment Stress Release Relax Massage Relief Head Care Massage,128915,2.8,56458,No Brand,1pc-claw-massager-body-massager-octopus-head-scalp-neck-equipment-stress-release-relax-massage-relief-head-care-massage,1,4.3,no description,2024-03-08
250306,5Pcs/Lot Feet Charms Stainless Steel Cute Baby Foot Pendant Double Hole Connectors for DIY Jewelry Making Supplies Accessories,120662,13.03,966,No Brand,5pcslot-feet-charms-stainless-steel-cute-baby-foot-pendant-double-hole-connectors-for-diy-jewelry-making-supplies-accessories,1,3.1,no description,2024-05-16
5158077,Tactical Gloves Outdoor Half-finger Protective Sports Training Cycling Non-slip Mountaineering Gloves Camping Equipment,137646,7.3,9999,No Brand,tactical-gloves-outdoor-half-finger-protective-sports-training-cycling-non-slip-mountaineering-gloves-camping-equipment,2,1.1,no description,2024-04-04
274326,Women's Handbags Purses Rose Flowers Vintage Bag Shell Lock Bags Chain Women Shoulder Crossbody Bag,15,70.11,293,No Brand,womens-handbags-purses-rose-flowers-vintage-bag-shell-lock-bags-chain-women-shoulder-crossbody-bag,1,4.8,no description,2024-04-15
274257,Genuine Leather Women's Handbags Luxury Fashion Lady Shell Tote Bag 2023 New Portable Crocodile Pattern Shoulder Crossbody Bags,15,209.18,100,No Brand,genuine-leather-womens-handbags-luxury-fashion-lady-shell-tote-bag-2023-new-portable-crocodile-pattern-shoulder-crossbody-bags,1,3.3,no description,2024-05-17
680045,Neck Waist Back Multifunctiona Massager Pad Electric Heating Vibrating Chair Home Cushion Pain Relief Winter Warmer Heating Pad,128915,220.46,100,No Brand,neck-waist-back-multifunctiona-massager-pad-electric-heating-vibrating-chair-home-cushion-pain-relief-winter-warmer-heating-pad,2,1.8,no description,2024-03-04
680287,2 In 1 Wireless Convenient Massage Waist Rechargeable Massage Neck Pillow Cervical Spine Car Massage Pad Electric Body Massager,128915,174.25,99,No Brand,2-in-1-wireless-convenient-massage-waist-rechargeable-massage-neck-pillow-cervical-spine-car-massage-pad-electric-body-massager,1,2.7,no description,2024-05-29
5157363,A-Z Canvas Totes bag Fashion Canvas Tote Letters Flower Portable Beach Shoulder Shopping Casual Beach Bag Large Capacity Handbag,15,22.34,432,No Brand,a-z-canvas-totes-bag-fashion-canvas-tote-letters-flower-portable-beach-shoulder-shopping-casual-beach-bag-large-capacity-handbag,2,2.9,no description,2024-05-14
250717,925 Sterling Silver charms Snow White Princess pendant Fit Original Pandora Bracelet Herocross disney apple jewelry women gift,120662,14.8,995,No Brand,925-sterling-silver-charms-snow-white-princess-pendant-fit-original-pandora-bracelet-herocross-disney-apple-jewelry-women-gift,2,4.0,no description,2024-03-23
275245,Luxury Saddle Women's Chest Bag Crossbody Bags Female Fashion Chain Handbag Hobos Bag Banana Belt Purse Banana Bag Fanny Packs,15,13.0,10,No Brand,luxury-saddle-womens-chest-bag-crossbody-bags-female-fashion-chain-handbag-hobos-bag-banana-belt-purse-banana-bag-fanny-packs,1,2.2,no description,2024-05-29
5160266,the Vampire Diaries shopping bag grocery shopper jute bag recycle bag cotton shopper bag bolsa compra woven sac tissu,15,15.66,962,No Brand,the-vampire-diaries-shopping-bag-grocery-shopper-jute-bag-recycle-bag-cotton-shopper-bag-bolsa-compra-woven-sac-tissu,1,3.2,no description,2024-05-13
276801,New natural shell bucket woven bag Japanese and Korean hand carry messenger dual-purpose straw bag casual women's bag,15,54.04,478,No Brand,new-natural-shell-bucket-woven-bag-japanese-and-korean-hand-carry-messenger-dual-purpose-straw-bag-casual-womens-bag,2,1.7,no description,2024-05-22
82090,Juya 18K Real Gold Plated New CreativeTree Of Life Evil Eye Moon Star Hamsa Love Heart Charms For DIY Pendant Jewelry Making,120662,12.85,69,No Brand,juya-18k-real-gold-plated-new-creativetree-of-life-evil-eye-moon-star-hamsa-love-heart-charms-for-diy-pendant-jewelry-making,1,2.2,no description,2024-05-30
274361,Dolphin Massager Handheld Electric Massage Stick Meridian Tapping Stick Shoulder Neck Tapping Cervical Neck Waist Meridian Back,128915,48.18,6665,No Brand,dolphin-massager-handheld-electric-massage-stick-meridian-tapping-stick-shoulder-neck-tapping-cervical-neck-waist-meridian-back,1,1.7,no description,2024-03-10
274431,Full Body Massage Rope Roller Wheels Relax Shoulders Legs Back Neck Strip,128915,5.02,999,No Brand,full-body-massage-rope-roller-wheels-relax-shoulders-legs-back-neck-strip,1,2.1,no description,2024-04-17
181321,New Massage Roller Manual Stainless Steel Massager Ball Body Therapy Massager for Neck Back Shoulder Face Lift Massage Tools,128915,8.35,999,No Brand,new-massage-roller-manual-stainless-steel-massager-ball-body-therapy-massager-for-neck-back-shoulder-face-lift-massage-tools,2,2.2,no description,2024-04-22
5081799,Touch Screen Tactical Gloves Army Military Gym Men Paintball Airsoft Shooting Combat Sports Cycling Hard Full Finger Gloves,137646,71.17,50,No Brand,touch-screen-tactical-gloves-army-military-gym-men-paintball-airsoft-shooting-combat-sports-cycling-hard-full-finger-gloves,1,1.9,no description,2024-04-20
274780,Manual One Head Spine Massager 6 Levels Portable Chiropractic Adjusting Tool for Muscle Relaxation Therapy Spinal Massage Gun,128915,181.58,300,No Brand,manual-one-head-spine-massager-6-levels-portable-chiropractic-adjusting-tool-for-muscle-relaxation-therapy-spinal-massage-gun,1,1.1,no description,2024-04-18
274699,Dual Trigger Point Roller Self-Massage Tools Deep Massage Shoulder Massager Light U-shaped Neck Massager Shiatsu Deep Tissue,128915,12.38,100,No Brand,dual-trigger-point-roller-self-massage-tools-deep-massage-shoulder-massager-light-u-shaped-neck-massager-shiatsu-deep-tissue,1,4.7,no description,2024-04-29
5676514,Colorful Mens Pocket Square Multicolor Paisley Classic Wedding Silk Handkerchief Business Jacquard Hanky,137646,2.86,1498,No Brand,colorful-mens-pocket-square-multicolor-paisley-classic-wedding-silk-handkerchief-business-jacquard-hanky,1,3.9,no description,2024-05-29
5159113,Non-Slip Warm Gloves Military Fan Tactical Gloves Outdoor Sports Gloves Riding Training Combat Defense Full/Half Finger Style,137646,13.4,123,No Brand,non-slip-warm-gloves-military-fan-tactical-gloves-outdoor-sports-gloves-riding-training-combat-defense-fullhalf-finger-style,2,3.6,no description,2024-03-02
671190,Diamond Lattice Chain Large Capacity Women Shoulder Bags New Luxury Design Classic Crossbody Summer Vintage Simple Style Handbag,15,68.99,976,No Brand,diamond-lattice-chain-large-capacity-women-shoulder-bags-new-luxury-design-classic-crossbody-summer-vintage-simple-style-handbag,2,1.4,no description,2024-05-07
280074,Portable Mini Wave Vibrating Massager Battery Usb Electric Handled Full Body Leg Neck Shoulder Relaxing Massage Tools,128915,26.83,6666,No Brand,portable-mini-wave-vibrating-massager-battery-usb-electric-handled-full-body-leg-neck-shoulder-relaxing-massage-tools,2,1.2,no description,2024-03-29
258534,50pcs/lot Mixed Color Resin Rose Flower Charms Pendants DIY Bracelet Keychain For Jewelry Making Accessories Gift,120662,12.58,9207,No Brand,50pcslot-mixed-color-resin-rose-flower-charms-pendants-diy-bracelet-keychain-for-jewelry-making-accessories-gift,1,2.4,no description,2024-04-12
258741,Cute Snacks Potato Chips Charms for Jewelry Making Diy Earring Bracelet Pendant Accessories Findings Wholesale Bulk,120662,10.35,706,No Brand,cute-snacks-potato-chips-charms-for-jewelry-making-diy-earring-bracelet-pendant-accessories-findings-wholesale-bulk,2,2.5,no description,2024-04-03
258584,Small Kawaii 3D Phone Charm - cartoon Cute Pastel Charms -cartoon Keychain - Keyring - Kawaii Gift - Charms,120662,6.38,989,No Brand,small-kawaii-3d-phone-charm-cartoon-cute-pastel-charms-cartoon-keychain-keyring-kawaii-gift-charms,2,2.1,no description,2024-05-03
258986,Wholesale Cartoon Fruits Charms for Jewelry Making Diy Earring Bracelet Pendant Accessories Findings Phone Making Bulk,120662,10.35,900,No Brand,wholesale-cartoon-fruits-charms-for-jewelry-making-diy-earring-bracelet-pendant-accessories-findings-phone-making-bulk,1,3.8,no description,2024-04-06
681935,Massageador Electric Heating Meteorite Cushion Office Winter Far Infrared Health Care Physiotherapy Chair Mat,128915,412.2,10,No Brand,massageador-electric-heating-meteorite-cushion-office-winter-far-infrared-health-care-physiotherapy-chair-mat,1,4.9,no description,2024-05-27
10933,100% Genuine Leather Crossbody Bag For Women Shoulder Bags 2023 Luxury Designer Handbag Female Solid Color Messenger Tote Sac,15,59.77,73,No Brand,100-genuine-leather-crossbody-bag-for-women-shoulder-bags-2023-luxury-designer-handbag-female-solid-color-messenger-tote-sac,1,4.6,no description,2024-05-24
681616,Germanium Stone Jade Stone Mattress Micro-physical Therapy Heated Tourmaline Chiar Cushion New 45cm*45cm Free Shipping,128915,212.4,10,No Brand,germanium-stone-jade-stone-mattress-micro-physical-therapy-heated-tourmaline-chiar-cushion-new-45cm45cm-free-shipping,2,4.4,no description,2024-03-29
281964,Electric Headache & Migraine Relief Head Massager TENS Microcurrent Sleep Aid Device Insomnia Sleep Instrument Pressure Relief,128915,80.14,362357,No Brand,electric-headache-migraine-relief-head-massager-tens-microcurrent-sleep-aid-device-insomnia-sleep-instrument-pressure-relief,1,2.2,no description,2024-04-02
110597,2023 New Trend Fashion Four Leaf Grass Printing Shoulder Strap Letter Printing Cross Body Camera Bag Women's Bag,15,19.02,993,No Brand,2023-new-trend-fashion-four-leaf-grass-printing-shoulder-strap-letter-printing-cross-body-camera-bag-womens-bag,1,1.4,no description,2024-03-06
5165010,Retro Fashion Men Canvas Shoes Spring and Autumn Male Sneakers Casual Shoes for Students Breathable Flats Spring and Autumn,134473,28.66,66,No Brand,retro-fashion-men-canvas-shoes-spring-and-autumn-male-sneakers-casual-shoes-for-students-breathable-flats-spring-and-autumn,1,3.9,no description,2024-05-17
671875,Young Girl Crossbody Bag Creative Caution Letters Sign Handbag Cute Fluorescence Color Shoulder Bags For Women 2023 Clutches,15,50.03,4783,No Brand,young-girl-crossbody-bag-creative-caution-letters-sign-handbag-cute-fluorescence-color-shoulder-bags-for-women-2023-clutches,1,1.2,no description,2024-05-16
671930,Anime Satchel BLEACH Backpack Unisex Leisure Travel Backpacks Rucksack Students School Book Bags For Kids Teenagers,15,44.59,1000,BLEACH,anime-satchel-bleach-backpack-unisex-leisure-travel-backpacks-rucksack-students-school-book-bags-for-kids-teenagers,2,2.0,no description,2024-03-22
9714,Women Canvas Messenger Bag Youth Ladies Fashion Shoulder Bag Student Large Capacity Female Crossbody Bags Woman Packet,15,20.54,10,No Brand,women-canvas-messenger-bag-youth-ladies-fashion-shoulder-bag-student-large-capacity-female-crossbody-bags-woman-packet,2,3.3,no description,2024-05-26
261633,Luxury 925 Sterling Silver 14k Gold Two-tone Splittable Sun & Moon Dangle Charm Fit Pandora Bracelet Women Jewelry Gifts,120662,15.04,8727,No Brand,luxury-925-sterling-silver-14k-gold-two-tone-splittable-sun-moon-dangle-charm-fit-pandora-bracelet-women-jewelry-gifts,2,4.5,no description,2024-04-04
283751,Women Acrylic star bag cute Designer pearl Evening Clutch Bag with strap For Wedding Party Luxury Purses Handbag,15,83.6,39,No Brand,women-acrylic-star-bag-cute-designer-pearl-evening-clutch-bag-with-strap-for-wedding-party-luxury-purses-handbag,1,1.8,no description,2024-05-15
5164832,Women's Shoes Summer Hidden Heel Wedges White Pink Sneakers Female Platform Breathable Mesh Black High Heel Casual Shoes2023,134473,20.94,98,No Brand,womens-shoes-summer-hidden-heel-wedges-white-pink-sneakers-female-platform-breathable-mesh-black-high-heel-casual-shoes2023,1,1.4,no description,2024-05-03
152431,1Bag 12 Styles Picture Color Hollow Hearts Charms Geometry Connector Pendant Metal Alloy DIY Necklace Bracelet Earrings Marking,120662,2.52,1984,No Brand,1bag-12-styles-picture-color-hollow-hearts-charms-geometry-connector-pendant-metal-alloy-diy-necklace-bracelet-earrings-marking,1,4.0,no description,2024-05-06
284040,New Chiropractic Adjustment Tools Manual Gun Improve Joint Pain Spine Therapy Adjust Vertebration Tool Portable 4 Heads Massager,128915,200.7,300,No Brand,new-chiropractic-adjustment-tools-manual-gun-improve-joint-pain-spine-therapy-adjust-vertebration-tool-portable-4-heads-massager,2,4.2,no description,2024-05-11
284294,Natural Resin Gua Sha Scraper Board Massage Beeswax Scraping Massager For Face Neck Shoulder Back Waist Acupoint Massage Tool,128915,23.74,25,No Brand,natural-resin-gua-sha-scraper-board-massage-beeswax-scraping-massager-for-face-neck-shoulder-back-waist-acupoint-massage-tool,1,2.3,no description,2024-05-04
287257,Headband Headache Migraine Relief Kneading Belt Air Pressure Head Massager Device Electric Head Massager Airbag Acupoint Massage,128915,469.58,984,No Brand,headband-headache-migraine-relief-kneading-belt-air-pressure-head-massager-device-electric-head-massager-airbag-acupoint-massage,1,3.7,no description,2024-05-11
200342,Wooden Massage Roller Portable Massage Tools For Face Neck Muscle Relax Head Foot Massager Stick Body Relaxation Beauty Health,128915,10.0,9999,No Brand,wooden-massage-roller-portable-massage-tools-for-face-neck-muscle-relax-head-foot-massager-stick-body-relaxation-beauty-health,2,3.5,no description,2024-05-08
266826,Cute Animal 925 Sterling Silver Blue Murano Glass Butterfly Charm Fit Original Pandora Bracelet Pendant Fine Jewelry Gift,120662,14.84,17,No Brand,cute-animal-925-sterling-silver-blue-murano-glass-butterfly-charm-fit-original-pandora-bracelet-pendant-fine-jewelry-gift,2,4.5,no description,2024-03-11
250029,Personalized Mini Shell Bags For Women Loving Heart Bag Metal Alloy Chain Shoulder Crossbody Bag Luxury Lipstick Coin Purses Sac,15,41.13,1056,No Brand,personalized-mini-shell-bags-for-women-loving-heart-bag-metal-alloy-chain-shoulder-crossbody-bag-luxury-lipstick-coin-purses-sac,1,1.0,no description,2024-03-19
5167862,White Canvas Shoes Breathable Girls Casual Sneakers 2023 Classic Lace-up Denim Sneakers Women,134473,19.79,189,No Brand,white-canvas-shoes-breathable-girls-casual-sneakers-2023-classic-lace-up-denim-sneakers-women,1,3.6,no description,2024-04-03
672824,New Kawaii Canvas Bag Japan Harajuku Crossbody Bags Girls Shoulder Bags Students Casual Messenger Bag Women's Bags,15,20.72,999,No Brand,new-kawaii-canvas-bag-japan-harajuku-crossbody-bags-girls-shoulder-bags-students-casual-messenger-bag-womens-bags,2,1.6,no description,2024-03-15
290935,Holy Death Print Wallet Mexico Skull Purses Key Credit Card Phone Holder Santa Muerte Coin Money Bag Ladies Long Wallets Gift,15,16.6,9999,No Brand,holy-death-print-wallet-mexico-skull-purses-key-credit-card-phone-holder-santa-muerte-coin-money-bag-ladies-long-wallets-gift,1,4.8,no description,2024-05-10
77927,10Pcs Candy Color Bear Pendant Charms for Necklace Bracelet Earrings Jewelry Making Diy Findings Resin Bears Christmas Making,120662,2.88,9980,No Brand,10pcs-candy-color-bear-pendant-charms-for-necklace-bracelet-earrings-jewelry-making-diy-findings-resin-bears-christmas-making,1,5.0,no description,2024-04-26
657303,New Tiny Infinity Crystal Pendant Necklaces For Women Choker Lucky Number Eight Geometric Gold/Silver Color Long Chain Necklace,120662,6.54,12719,No Brand,new-tiny-infinity-crystal-pendant-necklaces-for-women-choker-lucky-number-eight-geometric-goldsilver-color-long-chain-necklace,2,1.4,no description,2024-04-22
657343,Aide 925 Sterling Silver Minimalist Necklace Paperclip Chain Single Cubic Round Zircon Pendant Necklace For Women Wedding Gift,120662,19.2,60,No Brand,aide-925-sterling-silver-minimalist-necklace-paperclip-chain-single-cubic-round-zircon-pendant-necklace-for-women-wedding-gift,1,1.3,no description,2024-03-17
5327219,Vintage Red Flower Beads Tassel Hair Stick Headwear 2024 Autumn Winter Temperament Updo Hairpin Female New Year Hair Accessories,120662,2.8,500,No Brand,vintage-red-flower-beads-tassel-hair-stick-headwear-2024-autumn-winter-temperament-updo-hairpin-female-new-year-hair-accessories,2,4.9,no description,2024-03-21
291641,Manual Chiropractic Adjustment Tool Spine Massager Single Heads Chiropractic Adjusting Gun For New Portable Back Massage Gun,128915,165.57,300,No Brand,manual-chiropractic-adjustment-tool-spine-massager-single-heads-chiropractic-adjusting-gun-for-new-portable-back-massage-gun,1,2.1,no description,2024-04-12
271879,100% 925 Sterling Silver Butterfly Charms Pretty Handmade Necklace Bracelets Dangle Pendants DIY Fine Jewelry Making Findings,120662,2.92,8575,No Brand,100-925-sterling-silver-butterfly-charms-pretty-handmade-necklace-bracelets-dangle-pendants-diy-fine-jewelry-making-findings,2,3.5,no description,2024-03-08
272163,26Pcs/Lot Alloy with Rhinestones A-Z English Letter Alphabet Charm Pendants for DIY Necklace Jewelry Making Accessories,120662,11.65,50,No Brand,26pcslot-alloy-with-rhinestones-a-z-english-letter-alphabet-charm-pendants-for-diy-necklace-jewelry-making-accessories,1,4.7,no description,2024-04-27
5170997,Women Shopper bag Outlander in Typography Kawaii Bag Harajuku Shopping Canvas Shopper Bag girl handbag Tote Shoulder Lady Bag,15,20.3,9946,No Brand,women-shopper-bag-outlander-in-typography-kawaii-bag-harajuku-shopping-canvas-shopper-bag-girl-handbag-tote-shoulder-lady-bag,1,1.8,no description,2024-05-18
294266,"3 in 1 Maderoterapia Kit, Wood Therapy Massage Tools, Lymphatic Drainage Massager,Anti Cellulite Massager for Body Muscle Relief",128915,31.44,3000,No Brand,3-in-1-maderoterapia-kit-wood-therapy-massage-tools-lymphatic-drainage-massageranti-cellulite-massager-for-body-muscle-relief,1,4.5,no description,2024-03-18
297488,Large capacity multi card small bag PU women's wallet Women's sequin crocodile pattern handbag Long wallet,15,16.82,1000,No Brand,large-capacity-multi-card-small-bag-pu-womens-wallet-womens-sequin-crocodile-pattern-handbag-long-wallet,2,2.5,no description,2024-05-03
